{
  "$schema": "https://json-schema.org/draft/2020-12/schema",
  "title": "Qwen3 run manifest (v2)",
  "description": "Schema cho manifest Qwen3 trong manifests_qwen3/. Khac schema V1 o cho: (a) bat buoc co `regenerable` va `limitation` de noi ro thu gi khong kiem chung duoc, (b) `dataset_sha256` kem `dataset_sha256_scope` vi hash phu thuoc loai details, (c) `scorer_status` phai noi ro scorer co con tren dia hay khong.",
  "type": "object",
  "required": [
    "run_id",
    "model",
    "protocol",
    "dataset_sha256",
    "dataset_sha256_scope",
    "detail_schema",
    "scorer",
    "scorer_sha256",
    "scorer_status",
    "timestamp",
    "timestamp_source",
    "provenance",
    "regenerable",
    "limitation",
    "scores",
    "details"
  ],
  "properties": {
    "run_id": {
      "type": "string",
      "pattern": "^[0-9a-f]{16}$",
      "description": "sinh tu ten file + dataset_sha256; bat bien giup phat hien manifest bi sao chep."
    },
    "model": {"type": "string"},
    "model_path_kind": {
      "enum": ["registry-name", "local-directory", "path", null],
      "description": "Cho biet 'model' la ten trong Ollama hay basename cua thu muc dia. Duong dan may-lab khong duoc commit; chi giu basename."
    },
    "protocol": {"type": "string"},
    "dataset_sha256": {
      "type": "string",
      "pattern": "^[0-9a-f]{64}$",
      "description": "sha256 cua noi dung da cham thuc su. Pham vi chinh xac nam o dataset_sha256_scope."
    },
    "dataset_sha256_scope": {
      "type": "string",
      "description": "Bắt buộc: hash bao phu cai gi. Voi schema 'harness' chi khop tap cau, KHONG khop noi dung cau."
    },
    "detail_schema": {
      "enum": ["mmlu", "gsm", "typed", "harness"]
    },
    "scorer": {
      "type": ["string", "null"],
      "description": "duong dan tuong doi trong repo nay, hoac null neu khong xac dinh duoc."
    },
    "scorer_sha256": {
      "type": ["string", "null"],
      "pattern": "^[0-9a-f]{64}$",
      "description": "Hash cua script LUC CHAY -- nguon cua so lieu. Khong doi khi script bi sua sau do; ban moi ghi o current_sha256."
    },
    "current_sha256": {
      "type": ["string", "null"],
      "pattern": "^[0-9a-f]{64}$",
      "description": "Hash cua ban script dang nam tren dia. Khac scorer_sha256 nghia la da sua sau khi sinh so lieu."
    },
    "modified_after_run": {
      "type": ["boolean", "null"],
      "description": "true nghia la script bi sua sau khi sinh ra so lieu; phai kem modification."
    },
    "modification": {
      "type": ["string", "null"],
      "minLength": 30,
      "description": "Ly do sua, va cho biet du lieu co bi anh huong khong."
    },
    "generator_evidence": {
      "type": ["string", "null"],
      "description": "Tai sao tin script nay sinh ra manifest nay. Moi mapping can it nhat 2 bang chung doc lap (schema + tag/mau OUT/mtime). Khong co thi scorer=null."
    },
    "generator_version": {
      "type": ["string", "null"],
      "description": "Ban script nao trong cac ban da biet (v_orig/v_exp/v_text cua gsm_sweep). Chi dung khi xac dinh duoc bang dac diem."
    },
    "generator_features": {
      "type": ["string", "null"],
      "description": "Dac diem cua ban do (dong OUT, truong details) de nguoi doc tu kiem."
    },
    "version_note": {
      "type": ["string", "null"],
      "description": "Ghi ro khi lab khong co git: khong chung minh duoc file hien tai giong ban luc chay."
    },
    "scorer_status": {
      "enum": ["verified-on-disk", "source-digest-recorded", "script-khong-ton-tai", "khong-xac-dinh-duoc"]
    },
    "timestamp": {"type": "string"},
    "timestamp_source": {
      "type": "string",
      "description": "timestamp lay tu mtime file manifest, KHONG phai gio chay that."
    },
    "dataset_source": {
      "type": ["object", "null"],
      "description": "Hash noi dung dataset tai dung tu NGUON GOC (HF dataset), khong tu `details`. Khi co, hash chung minh duoc ca chi so lan noi dung cau; khi null, chi `dataset_sha256` yeu hon van dung.",
      "properties": {
        "dataset": {"type": "string"},
        "config": {"type": "string"},
        "split": {"type": "string"},
        "n_indices": {"type": "integer"},
        "index_range": {
          "type": ["array", "null"],
          "items": {"type": "integer"},
          "minItems": 2,
          "maxItems": 2
        },
        "sha256_full": {"type": "string", "pattern": "^[0-9a-f]{64}$"},
        "sha256_answer": {"type": "string", "pattern": "^[0-9a-f]{64}$"},
        "scope": {"type": "string"}
      }
    },
    "provenance": {
      "type": "object",
      "properties": {
        "gguf": {"type": "string"},
        "gguf_sha256": {"type": "string", "pattern": "^[0-9a-f]{64}$"},
        "gguf_bytes": {"type": "integer"},
        "gguf_resolved_via": {
          "enum": ["manifest.provenance.gguf", "ollama-modelfile-FROM-blob",
                   "legacy-model-to-file-map"]
        },
        "gguf_sha256_matches_original": {"type": "boolean"},
        "gguf_sha256_from_ollama_blob": {"type": "string", "pattern": "^[0-9a-f]{64}$"},
        "imatrix": {"type": ["string", "null"]},
        "gguf_available": {"type": "boolean"},
        "gguf_note": {"type": "string"}
      }
    },
    "regenerable": {
      "const": false,
      "description": "Tat ca manifest Qwen3 deu can GPU. Hang nay ton tai de nguoi doc khong tuong lai nham tinh lai tu 0."
    },
    "limitation": {"type": "string", "minLength": 20},
    "scores": {"type": "object"},
    "details": {"type": "array", "minItems": 1},
    "precision": {"type": "string"},
    "note": {"type": "string"}
  },
  "additionalProperties": true
}
