{
 "run_id": "4fbe40081361cd81",
 "model": "Qwen3-4B-Instruct-2507-FP16",
 "model_path_kind": "registry-name",
 "protocol": "khong-ghi",
 "dataset_sha256": "69381e4c19f6a4950d52bca6fe08a47991d94da88933dcc4d997d5b2bc33ddd4",
 "detail_schema": "harness",
 "dataset_sha256_scope": "CHI SHA256 CUA (i) -- manifest khong luu dap an mong doi, nen hash chi pin duoc TAP CAU, KHONG pin duoc noi dung cau. Khong du de chung minh dataset khong doi.",
 "scorer": "bench/qwen3/gsm_sweep.py",
 "scorer_sha256": "457690e0a96bfe27ec2c9a9ee4602d28c6f345af7971021ae64d37089f91f107",
 "scorer_status": "verified-on-disk",
 "current_sha256": "7e5ec003777b9a2ffb598b49bb0d3f0eb35b4575e17b5dacf72ed9480ca1953a",
 "modified_after_run": true,
 "modification": "Ten file manifest khong kem offset (OUT khong co _{a.offset}, con CK thi co), nen block offset=200 de file manifest cua block offset=0. DU LIEU KHONG MAT: checkpoint giu 200 cau moi block, va merge_gsm_blocks.py gop lai duoc, kiem tra trung i. Chi 1 manifest bi de; duoc ghi lai tu checkpoint.",
 "timestamp": "2026-09-26T16:36:18.801500Z",
 "timestamp_source": "file-mtime-cua-manifest, KHONG phai gio chay thoi",
 "provenance": {
  "gguf_available": false,
  "gguf_note": "Khong xac dinh duoc artifact: manifest khong tro ten file, va ten model Ollama khong con."
 },
 "dataset_source": null,
 "regenerable": false,
 "limitation": "Diem khong tai lap duoc: can GGUF 2.5GB + Ollama + ~20-140 phut GPU. CI chi verify tinh toan, khong tao lai diem.",
 "scores": {
  "gsm50_256": 36,
  "elapsed_s": 12919,
  "timestamp": "2026-09-26T23:36"
 },
 "details": [
  {
   "i": 0,
   "pass": true
  },
  {
   "i": 1,
   "pass": true
  },
  {
   "i": 2,
   "pass": false
  },
  {
   "i": 3,
   "pass": true
  },
  {
   "i": 4,
   "pass": true
  },
  {
   "i": 5,
   "pass": false
  },
  {
   "i": 6,
   "pass": true
  },
  {
   "i": 7,
   "pass": false
  },
  {
   "i": 8,
   "pass": false
  },
  {
   "i": 9,
   "pass": true
  },
  {
   "i": 10,
   "pass": true
  },
  {
   "i": 11,
   "pass": true
  },
  {
   "i": 12,
   "pass": false
  },
  {
   "i": 13,
   "pass": false
  },
  {
   "i": 14,
   "pass": false
  },
  {
   "i": 15,
   "pass": false
  },
  {
   "i": 16,
   "pass": true
  },
  {
   "i": 17,
   "pass": true
  },
  {
   "i": 18,
   "pass": true
  },
  {
   "i": 19,
   "pass": false
  },
  {
   "i": 20,
   "pass": true
  },
  {
   "i": 21,
   "pass": true
  },
  {
   "i": 22,
   "pass": true
  },
  {
   "i": 23,
   "pass": true
  },
  {
   "i": 24,
   "pass": true
  },
  {
   "i": 25,
   "pass": true
  },
  {
   "i": 26,
   "pass": false
  },
  {
   "i": 27,
   "pass": true
  },
  {
   "i": 28,
   "pass": true
  },
  {
   "i": 29,
   "pass": true
  },
  {
   "i": 30,
   "pass": true
  },
  {
   "i": 31,
   "pass": false
  },
  {
   "i": 32,
   "pass": true
  },
  {
   "i": 33,
   "pass": true
  },
  {
   "i": 34,
   "pass": true
  },
  {
   "i": 35,
   "pass": true
  },
  {
   "i": 36,
   "pass": true
  },
  {
   "i": 37,
   "pass": false
  },
  {
   "i": 38,
   "pass": true
  },
  {
   "i": 39,
   "pass": true
  },
  {
   "i": 40,
   "pass": true
  },
  {
   "i": 41,
   "pass": true
  },
  {
   "i": 42,
   "pass": true
  },
  {
   "i": 43,
   "pass": true
  },
  {
   "i": 44,
   "pass": true
  },
  {
   "i": 45,
   "pass": false
  },
  {
   "i": 46,
   "pass": true
  },
  {
   "i": 47,
   "pass": false
  },
  {
   "i": 48,
   "pass": true
  },
  {
   "i": 49,
   "pass": true
  }
 ]
}